{"schema":"sipi.run-result.v1","run_id":"run-auto","analysis_id":"analysis-1","attempt_id":"attempt-1","operation":"link.simulate.v1","payload_schema":"pybert.simulation.v1","status":"succeeded","selection_requested":{"mode":"auto","candidates":["pybert-python","pybert-rust"],"fallback_on":["EngineUnavailable","UnsupportedCapability"]},"backend_executions":[{"backend_execution_id":"backend-2","role":"primary","engine_instance_id":"pybert-rust","bundle_hash":"sha256:bundle","status":"succeeded","domain_result_schema":"pybert.simulation.v1","artifacts":[{"schema":"sipi.artifact-ref.v1","content_schema":"pybert.output.v1","relative_path":"backends/backend-2/artifacts/result.json","mime_type":"application/json","sha256":"aaaaaaaaaaaaaaaaaaaaaaaaaaaaaaaaaaaaaaaaaaaaaaaaaaaaaaaaaaaaaaaa","byte_length":1,"producer":"fixture.adapter","role":"domain_result","extensions":{}}],"error":null}],"fallback_trace":[{"instance":"pybert-python","reason":"EngineUnavailable"}],"comparison":{},"metrics_summary":{},"artifacts":[],"events":[],"warnings":[],"provenance":{"producers":[{"id":"fixture.platform","kind":"platform","name":"fixture","version":"1","commit":null,"build_profile":null,"dirty":false,"bundle_hash":null,"parent_ids":[]},{"id":"fixture.adapter","kind":"adapter","name":"fixture","version":"1","commit":null,"build_profile":null,"dirty":false,"bundle_hash":null,"parent_ids":["fixture.platform"]},{"id":"fixture.engine","kind":"engine","name":"fixture","version":"1","commit":null,"build_profile":null,"dirty":false,"bundle_hash":null,"parent_ids":["fixture.adapter"]},{"id":"fixture.algorithm","kind":"algorithm","name":"fixture","version":"1","commit":null,"build_profile":null,"dirty":false,"bundle_hash":null,"parent_ids":["fixture.engine"]}],"request":{"schema":"pybert.simulation.v1","behavior_profile":"fixture","inputs":[],"resolved_config_sha256":"aaaaaaaaaaaaaaaaaaaaaaaaaaaaaaaaaaaaaaaaaaaaaaaaaaaaaaaaaaaaaaaa"},"environment":{"python":null,"rust":null,"os":"windows","cpu":"fixture","blas":null,"thread_count":1,"dependency_locks":[]},"randomness":{"seed":null,"array_sources":[]},"policies":{"fallback":[],"conditioning":[],"repairs":[],"truncations":[],"approximations":[]},"extensions":{}},"timings":{},"resource_usage":{"actual_enforcement":{"wall_time_s":"unsupported","cpu_time_s":"unsupported","memory_bytes":"unsupported","process_count":"unsupported","artifact_bytes":"unsupported"}},"error":null,"extensions":{}}
